{
  "version": "0.3",
  "metadata": {
    "project": "user-registration-case",
    "created_at": "2026-03-14T00:00:00Z",
    "specification_closure": true,
    "contract_version": "v2"
  },
  "nodes": [
    {
      "id": "tbl-registration-request",
      "name": "RegistrationRequest",
      "type": "table",
      "signature_ref": "tbl-registration-request"
    },
    {
      "id": "fn-register-user",
      "name": "RegisterUser",
      "type": "function",
      "is_aggregated": true,
      "contract": {
        "Cin": [
          "tbl-registration-request"
        ],
        "Cout": [
          "tbl-user",
          "tbl-registration-event",
          "tbl-registration-error"
        ],
        "R": [
          "tbl-user"
        ],
        "W": [
          "tbl-audit-log"
        ],
        "Tin": [],
        "Tout": [
          "fn-send-confirmation"
        ]
      }
    },
    {
      "id": "tbl-user",
      "name": "User",
      "type": "table",
      "signature_ref": "tbl-user"
    },
    {
      "id": "tbl-registration-event",
      "name": "RegistrationEvent",
      "type": "table",
      "signature_ref": "tbl-registration-event"
    },
    {
      "id": "tbl-registration-error",
      "name": "RegistrationError",
      "type": "table",
      "signature_ref": "tbl-registration-error"
    },
    {
      "id": "tbl-audit-log",
      "name": "AuditLog",
      "type": "table",
      "signature_ref": "tbl-audit-log"
    },
    {
      "id": "fn-send-confirmation",
      "name": "SendConfirmation",
      "type": "function",
      "contract": {
        "Cin": [
          "tbl-user"
        ],
        "Cout": [
          "tbl-notification-event"
        ],
        "R": [],
        "W": [],
        "Tin": [
          "fn-register-user"
        ],
        "Tout": []
      }
    },
    {
      "id": "tbl-notification-event",
      "name": "NotificationEvent",
      "type": "table",
      "signature_ref": "tbl-notification-event"
    }
  ],
  "edges": [
    {
      "id": "e1",
      "source": "tbl-registration-request",
      "target": "fn-register-user",
      "type": "consumes"
    },
    {
      "id": "e2",
      "source": "fn-register-user",
      "target": "tbl-user",
      "type": "produces"
    },
    {
      "id": "e3",
      "source": "fn-register-user",
      "target": "tbl-registration-event",
      "type": "produces"
    },
    {
      "id": "e4",
      "source": "fn-register-user",
      "target": "tbl-registration-error",
      "type": "produces"
    },
    {
      "id": "e5",
      "source": "tbl-user",
      "target": "fn-register-user",
      "type": "reads"
    },
    {
      "id": "e6",
      "source": "fn-register-user",
      "target": "tbl-audit-log",
      "type": "writes"
    },
    {
      "id": "e7",
      "source": "fn-register-user",
      "target": "fn-send-confirmation",
      "type": "triggers"
    },
    {
      "id": "e8",
      "source": "tbl-user",
      "target": "fn-send-confirmation",
      "type": "consumes"
    },
    {
      "id": "e9",
      "source": "fn-send-confirmation",
      "target": "tbl-notification-event",
      "type": "produces"
    }
  ],
  "refinement_maps": [
    {
      "aggregated_node": "fn-register-user",
      "internal_functions": [
        {
          "id": "fn-validate-input",
          "name": "ValidateInput",
          "contract": {
            "Cin": [
              "tbl-registration-request"
            ],
            "Cout": [
              "tbl-validated-request",
              "tbl-registration-error"
            ],
            "R": [],
            "W": [
              "tbl-audit-log"
            ],
            "Tin": [],
            "Tout": []
          }
        },
        {
          "id": "fn-check-uniqueness",
          "name": "CheckUniqueness",
          "contract": {
            "Cin": [
              "tbl-validated-request"
            ],
            "Cout": [
              "tbl-unique-request",
              "tbl-registration-error"
            ],
            "R": [
              "tbl-user"
            ],
            "W": [
              "tbl-audit-log"
            ],
            "Tin": [],
            "Tout": []
          }
        },
        {
          "id": "fn-create-user",
          "name": "CreateUser",
          "contract": {
            "Cin": [
              "tbl-unique-request"
            ],
            "Cout": [
              "tbl-user",
              "tbl-registration-event"
            ],
            "R": [],
            "W": [
              "tbl-audit-log"
            ],
            "Tin": [],
            "Tout": [
              "fn-send-confirmation-internal"
            ]
          }
        },
        {
          "id": "fn-send-confirmation-internal",
          "name": "SendConfirmation",
          "contract": {
            "Cin": [
              "tbl-user"
            ],
            "Cout": [
              "tbl-notification-event"
            ],
            "R": [],
            "W": [],
            "Tin": [
              "fn-create-user"
            ],
            "Tout": []
          }
        }
      ],
      "internal_tables": [
        {
          "id": "tbl-validated-request",
          "name": "ValidatedRequest",
          "signature_ref": "tbl-validated-request"
        },
        {
          "id": "tbl-unique-request",
          "name": "UniqueRequest",
          "signature_ref": "tbl-unique-request"
        }
      ],
      "internal_edges": [
        {
          "id": "ie1",
          "source": "tbl-registration-request",
          "target": "fn-validate-input",
          "type": "consumes"
        },
        {
          "id": "ie2",
          "source": "fn-validate-input",
          "target": "tbl-validated-request",
          "type": "produces"
        },
        {
          "id": "ie3",
          "source": "fn-validate-input",
          "target": "tbl-registration-error",
          "type": "produces"
        },
        {
          "id": "ie4",
          "source": "fn-validate-input",
          "target": "tbl-audit-log",
          "type": "writes"
        },
        {
          "id": "ie5",
          "source": "tbl-validated-request",
          "target": "fn-check-uniqueness",
          "type": "consumes"
        },
        {
          "id": "ie6",
          "source": "fn-check-uniqueness",
          "target": "tbl-unique-request",
          "type": "produces"
        },
        {
          "id": "ie7",
          "source": "fn-check-uniqueness",
          "target": "tbl-registration-error",
          "type": "produces"
        },
        {
          "id": "ie8",
          "source": "tbl-user",
          "target": "fn-check-uniqueness",
          "type": "reads"
        },
        {
          "id": "ie9",
          "source": "fn-check-uniqueness",
          "target": "tbl-audit-log",
          "type": "writes"
        },
        {
          "id": "ie10",
          "source": "tbl-unique-request",
          "target": "fn-create-user",
          "type": "consumes"
        },
        {
          "id": "ie11",
          "source": "fn-create-user",
          "target": "tbl-user",
          "type": "produces"
        },
        {
          "id": "ie12",
          "source": "fn-create-user",
          "target": "tbl-registration-event",
          "type": "produces"
        },
        {
          "id": "ie13",
          "source": "fn-create-user",
          "target": "tbl-audit-log",
          "type": "writes"
        },
        {
          "id": "ie14",
          "source": "fn-create-user",
          "target": "fn-send-confirmation-internal",
          "type": "triggers"
        },
        {
          "id": "ie15",
          "source": "tbl-user",
          "target": "fn-send-confirmation-internal",
          "type": "consumes"
        },
        {
          "id": "ie16",
          "source": "fn-send-confirmation-internal",
          "target": "tbl-notification-event",
          "type": "produces"
        }
      ],
      "contract_version": "v2"
    }
  ]
}